{
  "key": "5555555555555555555555555555555555555555555555555555555555555555",
  "type": "operator_precedent",
  "created_at": "2026-05-20T09:20:00Z",
  "created_by": "operator",
  "role": "operator",
  "milestone_id": "v3.0",
  "phase_id": "106",
  "cat7": {
    "focus": "operator precedent",
    "issue": "authority boundary",
    "intent": "record highest decision",
    "motivation": "avoid synthetic operator authority",
    "commitment": "operator-only precedent",
    "perspective": "operator",
    "mood": "settled"
  },
  "body": {
    "precedent": "Only the real operator can establish highest-authority memory precedents."
  },
  "lineage": {
    "parents": [],
    "ancestors": []
  },
  "authority_level": "decision_highest",
  "evidence_refs": [],
  "status": "emitted"
}
