{
  "key": "2222222222222222222222222222222222222222222222222222222222222222",
  "type": "review_finding",
  "created_at": "2026-05-20T09:05:00Z",
  "created_by": "atc-v4",
  "role": "reviewer",
  "milestone_id": "v3.0",
  "phase_id": "106",
  "cat7": {
    "focus": "review claim",
    "issue": "schema invariant",
    "intent": "flag contract risk",
    "motivation": "prevent invalid promotion",
    "commitment": "review evidence",
    "perspective": "reviewer",
    "mood": "focused"
  },
  "body": {
    "severity": "WARN",
    "claim": "Review findings must remain claims until an evidence verdict is emitted.",
    "current_commit": "4a5b6c7"
  },
  "lineage": {
    "parents": [],
    "ancestors": []
  },
  "authority_level": "claim",
  "evidence_refs": [],
  "status": "emitted"
}
