{
  "key": "3333333333333333333333333333333333333333333333333333333333333333",
  "type": "evidence_verdict",
  "created_at": "2026-05-20T09:10:00Z",
  "created_by": "evidence_validator",
  "role": "evidence_validator",
  "milestone_id": "v3.0",
  "phase_id": "106",
  "cat7": {
    "focus": "claim validation",
    "issue": "review finding status",
    "intent": "adjudicate evidence",
    "motivation": "separate claim from authority",
    "commitment": "validated verdict",
    "perspective": "validator",
    "mood": "neutral"
  },
  "body": {
    "evidence_status": "REFUTED_CRIT",
    "tier_used": 1,
    "decision_basis": "Schema fixture parse proof refutes the fictional critical finding."
  },
  "lineage": {
    "parents": [
      "cmb_review_finding_001"
    ],
    "ancestors": [
      "cmb_review_finding_001"
    ]
  },
  "authority_level": "claim_with_authority",
  "evidence_refs": [
    "cmb_review_finding_001"
  ],
  "status": "emitted"
}
