{
  "key": "7777777777777777777777777777777777777777777777777777777777777777",
  "type": "promotion_decision",
  "created_at": "2026-05-20T09:30:00Z",
  "created_by": "sgsd",
  "role": "sgsd",
  "milestone_id": "v3.0",
  "phase_id": "106",
  "cat7": {
    "focus": "phase promotion",
    "issue": "review outcome",
    "intent": "record terminal verdict",
    "motivation": "close phase with evidence",
    "commitment": "promotion ledger entry",
    "perspective": "system",
    "mood": "resolved"
  },
  "body": {
    "verdict": "PASS_WITH_REFUTED_REVIEW",
    "phase": "106"
  },
  "lineage": {
    "parents": [
      "cmb_review_finding_001"
    ],
    "ancestors": [
      "cmb_review_finding_001"
    ]
  },
  "authority_level": "decision",
  "evidence_refs": [
    "cmb_review_finding_001"
  ],
  "status": "emitted"
}
