{
  "key": "6666666666666666666666666666666666666666666666666666666666666666",
  "type": "context_anchor",
  "created_at": "2026-05-20T09:25:00Z",
  "created_by": "context_authority",
  "role": "context_authority",
  "milestone_id": "v3.0",
  "phase_id": "106",
  "cat7": {
    "focus": "context projection",
    "issue": "canonical source",
    "intent": "anchor derived context",
    "motivation": "make projection auditable",
    "commitment": "source-backed anchor",
    "perspective": "context authority",
    "mood": "precise"
  },
  "body": {
    "canonical_source_path": ".planning/milestones/v3.0/context/MILESTONE-CONTEXT.yaml",
    "canonical_source_hash": "sha256-stub",
    "projection_summary": "Fictional v3.0 milestone context anchor for downstream mesh memory tests."
  },
  "lineage": {
    "parents": [],
    "ancestors": []
  },
  "authority_level": "projection",
  "evidence_refs": [],
  "status": "emitted"
}
