{
  "key": "4444444444444444444444444444444444444444444444444444444444444444",
  "type": "decision_recommendation",
  "created_at": "2026-05-20T09:15:00Z",
  "created_by": "pseudo_operator",
  "role": "pseudo_operator",
  "milestone_id": "v3.0",
  "phase_id": "106",
  "cat7": {
    "focus": "promotion advice",
    "issue": "contract readiness",
    "intent": "recommend next action",
    "motivation": "preserve operator boundary",
    "commitment": "bounded recommendation",
    "perspective": "pseudo operator",
    "mood": "calibrated"
  },
  "body": {
    "recommendation": "Proceed to P107 validation tooling after schema parse checks pass.",
    "authority_level": 3,
    "confidence": 0.93,
    "real_operator_required": false,
    "context_pack_id": "ctx-v3-p106",
    "evidence_refs": [
      "cmb_review_finding_001"
    ],
    "carve_outs_triggered": []
  },
  "lineage": {
    "parents": [
      "cmb_review_finding_001"
    ],
    "ancestors": [
      "cmb_review_finding_001"
    ]
  },
  "authority_level": "decision",
  "evidence_refs": [
    "cmb_review_finding_001"
  ],
  "status": "emitted"
}
