{
  "key": "1111111111111111111111111111111111111111111111111111111111111111",
  "type": "execution_receipt",
  "created_at": "2026-05-20T09:00:00Z",
  "created_by": "sgsd-wrapper",
  "role": "sgsd",
  "milestone_id": "v3.0",
  "phase_id": "106",
  "cat7": {
    "focus": "cmb schema",
    "issue": "contract emission",
    "intent": "record execution",
    "motivation": "preserve evidence",
    "commitment": "schema-valid receipt",
    "perspective": "system",
    "mood": "neutral"
  },
  "body": {
    "commit_before": "0f1e2d3",
    "commit_after": "4a5b6c7",
    "changed_files": [
      "super-gsd/schemas/cmb.schema.json"
    ],
    "tests_run": [
      {
        "command": "node -e \"JSON.parse(require('fs').readFileSync('super-gsd/schemas/cmb.schema.json'))\"",
        "result": "pass",
        "count": 1
      }
    ],
    "report_path": ".planning/milestones/v3.0/phases/106-mesh-cmb-schema/verification/execution-receipt.md",
    "report_hash": "sha256-report-stub",
    "acceptance_criteria_touched": [
      "SAC-P106-01"
    ]
  },
  "lineage": {
    "parents": [],
    "ancestors": []
  },
  "authority_level": "observation",
  "evidence_refs": [],
  "status": "emitted"
}
